{"$id":"event","$schema":"https://json-schema.org/draft/2020-12/schema","description":"A single appended, hash-chained state-change record. The JSONL session log is the source of truth; hash = sha256 of canonical JSON of {seq, ts, type, payload_sha256, prev_hash}.","properties":{"hash":{"description":"Chain hash over {seq, ts, type, payload_sha256, prev_hash}.","type":"string"},"payload":{"description":"Event body; schema depends on type.","type":"object"},"payload_sha256":{"description":"sha256 of canonical JSON of payload.","type":"string"},"prev_hash":{"description":"Previous event hash; 64 zeros for seq 1.","type":"string"},"seq":{"description":"1-based sequence number; contiguous, no gaps.","minimum":1,"type":"integer"},"ts":{"description":"UTC timestamp of append.","format":"date-time","type":"string"},"type":{"description":"Event kind.","enum":["adapter_fingerprinted","asr_segment","codes_clear_requested","codes_cleared","evidence_added","hypothesis_proposed","llm_call","observation_added","posterior_updated","report_built","safety_ack","sam_call","session_started","test_performed","test_requested","test_result"]}},"required":["hash","payload","payload_sha256","prev_hash","seq","ts","type"],"type":"object"}
