{"hash":"f2240216b1db97b1a58b2bcd14c21c07d73025ef38ed6719fe9c2e2b054bbb26","payload":{"session_id":"sess_001"},"payload_sha256":"9470b657b3a3ed3a0c4bca276ed79e95340a1802b4487a369b9766126cc3859e","prev_hash":"0000000000000000000000000000000000000000000000000000000000000000","seq":1,"ts":"2026-10-28T12:00:00+00:00","type":"session_started"}
